{"$schema":"https://json-schema.org/draft/2020-12/schema","$id":"urn:aicontrolcenter:governance:v1:precondition-snapshot","title":"GovernancePreconditionSnapshot","type":"object","additionalProperties":false,"required":["schema_version","snapshot_id","lifecycle_id","request_id","collected_at","collector_identities","target_identity","git_state_binding","runtime_identity_binding","security_state_bindings","manifest_bindings","operational_state_bindings","policy_version","snapshot_digest"],"properties":{"schema_version":{"const":"governance/v1"},"snapshot_id":{"$ref":"#/$defs/text"},"lifecycle_id":{"$ref":"#/$defs/text"},"request_id":{"$ref":"#/$defs/text"},"collected_at":{"type":"string","format":"date-time"},"collector_identities":{"type":"array","minItems":1,"uniqueItems":true,"items":{"$ref":"#/$defs/identity"}},"target_identity":{"$ref":"#/$defs/identity"},"git_state_binding":{"$ref":"#/$defs/binding"},"runtime_identity_binding":{"$ref":"#/$defs/binding"},"security_state_bindings":{"$ref":"#/$defs/bindings"},"manifest_bindings":{"$ref":"#/$defs/bindings"},"operational_state_bindings":{"$ref":"#/$defs/bindings"},"policy_version":{"$ref":"#/$defs/text"},"snapshot_digest":{"$ref":"#/$defs/text"}},"$defs":{"text":{"type":"string","minLength":1},"identity":{"type":"object","additionalProperties":false,"required":["identity_id","identity_type"],"properties":{"identity_id":{"$ref":"#/$defs/text"},"identity_type":{"$ref":"#/$defs/text"}}},"binding":{"type":"object","additionalProperties":false,"required":["name","value"],"properties":{"name":{"$ref":"#/$defs/text"},"value":{"$ref":"#/$defs/text"}}},"bindings":{"type":"array","uniqueItems":true,"items":{"$ref":"#/$defs/binding"}},"comparison_status":{"enum":["MATCH","DRIFT"]}}}
