{"schema_version":"governance/v1","snapshot_id":"snapshot-synthetic-001","lifecycle_id":"lifecycle-synthetic-001","request_id":"request-synthetic-001","collected_at":"2026-08-10T00:01:00+00:00","collector_identities":[{"identity_id":"collector-synthetic","identity_type":"SERVICE"}],"target_identity":{"identity_id":"repository-synthetic","identity_type":"REPOSITORY"},"git_state_binding":{"name":"commit","value":"commit-synthetic-001"},"runtime_identity_binding":{"name":"runtime","value":"runtime-synthetic-001"},"security_state_bindings":[],"manifest_bindings":[],"operational_state_bindings":[],"policy_version":"policy-v1","snapshot_digest":"digest-snapshot-synthetic-001"}
